{
  "orbit_id": "leo45",
  "frame": "ECEF",
  "points": [
    {
      "t_utc": "2026-10-05T13:40:00Z",
      "lat_deg": 45.28,
      "lon_deg": -60.94,
      "alt_km": 549.6
    },
    {
      "t_utc": "2026-10-05T13:45:00Z",
      "lat_deg": 48.11,
      "lon_deg": -54.72,
      "alt_km": 549.9
    }
  ],
  "ground_track_valid": true,
  "constants_block": {
    "J2": 0.000108262668,
    "GM": 398600441800000.0,
    "R_e": 6378137.0,
    "omega_sid_rad_s": 7.292115e-05,
    "gmst_model": "IAU_1982",
    "citation_id": "run_20261003_7f3a91c2",
    "source": {
      "J2": "spec II.10 constants table"
    }
  }
}
